{
  "issue": {
    "number": 3,
    "date": "2026-09-07",
    "title": "黄金全球信息周报"
  },
  "window": {
    "start": "2026-08-31",
    "end": "2026-09-07"
  },
  "overview": [
    "美国 8 月非农就业增加 16.2 万人，失业率维持 4.1%；平均时薪环比上涨 0.3%、同比上涨 3.1%，劳动力市场表现明显强于此前数月。",
    "美国 7 月职位空缺为 727.1 万个，招聘和离职均变化不大，JOLTS 继续显示劳动力市场没有出现明显失速。",
    "欧元区 8 月通胀初值升至 3.3%，高于 7 月的 2.9%；能源同比涨幅从 10.3%进一步升至 14.3%，是本次通胀上行的主要来源。",
    "美国二季度非农商业部门劳动生产率修订后年化增长 1.4%，单位劳动力成本年化增长 1.2%。",
    "强劲就业数据提高了市场对美联储 9 月加息的押注；9 月 7 日现货黄金约跌至 4,403 美元/盎司附近，Reuters 报道中的市场定价一度显示加息概率接近六成。",
    "世界黄金协会 9 月 3 日公布的央行黄金统计显示，7 月全球央行净购金约 23 吨；中国买入约 20 吨，波兰约 8 吨，而俄罗斯净卖出约 6 吨。",
    "截至 9 月 2 日的一周，Reuters 基于 LSEG Lipper 的基金流向数据显示，全球货币市场基金净流入 461 亿美元；黄金和贵金属基金继续获得资金流入。",
    "霍尔木兹海峡的实际航运继续受压。Reuters 9 月 6 日报道，过去 10 天商品船平均每日通行量降至约 10 艘，为 5 月以来最低水平。",
    "OPEC+ 9 月 6 日决定 10 月维持当前产量政策不变，没有继续提高目标产量；组织将更多注意力转向 2027 年配额和成员国产能评估。",
    "日本 8 月外汇储备出现有记录以来最大单月降幅，Reuters 援引日本财务省数据称储备减少 796 亿美元，主要与大规模买入日元、卖出美元的干预有关。"
  ],
  "sections": [
    {
      "id": "macro",
      "title": "国际宏观与政策",
      "groups": [
        {
          "name": "美国",
          "items": [
            {
              "source_level": "primary",
              "source_name": "U.S. Bureau of Labor Statistics",
              "published": "2026-09-04",
              "title": "The Employment Situation — August 2026",
              "summary": "美国 8 月非农就业增加 16.2 万人，明显高于此前 12 个月月均约 3.1 万人的增幅；失业率维持 4.1%。餐饮业增加 5.9 万个岗位，地方政府教育增加 4.2 万个岗位；信息业就业下降。私营非农平均时薪环比上涨 0.3%至 37.75 美元，同比上涨 3.1%。6 月和 7 月就业合计上修 5.5 万人。",
              "why_it_matters": "就业明显回升意味着美联储在处理高于目标的通胀时拥有更大的紧缩空间，因此直接影响短端利率、美元和黄金。",
              "information_type": "官方就业统计",
              "url": "https://www.bls.gov/news.release/archives/empsit_09042026.htm"
            },
            {
              "source_level": "primary",
              "source_name": "U.S. Bureau of Labor Statistics",
              "published": "2026-09-01",
              "title": "Job Openings and Labor Turnover — July 2026",
              "summary": "7 月美国职位空缺约为 727.1 万个，职位空缺率为 4.4%；招聘人数约 510 万，离职总人数约 510 万，主动离职约 310 万，裁员和解雇约 170 万，整体较前月变化不大。",
              "why_it_matters": "JOLTS 说明劳动力需求仍然具有韧性，与 8 月就业报告一起强化了劳动力市场没有明显失速的判断。",
              "information_type": "官方劳动力市场统计",
              "url": "https://www.bls.gov/news.release/jolts.nr0.htm"
            },
            {
              "source_level": "primary",
              "source_name": "U.S. Bureau of Labor Statistics",
              "published": "2026-09-03",
              "title": "Productivity and Costs — Second Quarter 2026, Revised",
              "summary": "美国二季度非农商业部门劳动生产率修订后按年率增长 1.4%，其中产出增长 1.7%、工时增长 0.3%；单位劳动力成本年化增长 1.2%。与上年同期相比，劳动生产率增长 2.2%。",
              "why_it_matters": "生产率和单位劳动力成本是判断工资压力能否转化为持续通胀的重要补充指标。",
              "information_type": "官方生产率与成本统计",
              "url": "https://www.bls.gov/news.release/prod2.nr0.htm"
            },
            {
              "source_level": "media",
              "source_name": "Reuters",
              "published": "2026-09-04",
              "title": "Yields, dollar rise, stocks ease after solid US jobs report",
              "summary": "Reuters 报道称，8 月就业数据公布后，美国国债收益率和美元上升，市场提高了对 9 月加息的押注。2 年期美债收益率一度升至约 4.37%，10 年期约 4.78%；现货黄金当日下跌约 1.2%。",
              "caveat": "市场加息概率来自期货定价，会随新数据快速变化；政策事实仍应以 FOMC 决议为准。",
              "information_type": "跨资产市场反应报道",
              "url": "https://www.reuters.com/world/china/global-markets-wrapup-1-2026-09-04/"
            }
          ]
        },
        {
          "name": "欧元区与英国",
          "items": [
            {
              "source_level": "primary",
              "source_name": "Eurostat",
              "published": "2026-09-01",
              "title": "Euro area annual inflation up to 3.3%",
              "summary": "Eurostat 快速估算显示，欧元区 8 月年度 HICP 通胀率为 3.3%，高于 7 月的 2.9%。能源同比涨幅由 10.3%升至 14.3%，是增速最高的主要分项；服务通胀从 3.3%降至 3.0%，剔除能源后的通胀为 2.2%。",
              "why_it_matters": "能源价格正在重新推高欧元区总体通胀。ECB 将在 9 月 10 日举行货币政策会议，因此这份数据是最关键的会前输入之一。",
              "information_type": "官方通胀快速估算",
              "url": "https://ec.europa.eu/eurostat/web/products-euro-indicators/w/2-01092026-ap"
            },
            {
              "source_level": "context",
              "source_name": "European Central Bank",
              "published": "2026-09-04",
              "title": "Weekly schedule — 9 to 11 September 2026",
              "summary": "ECB 官方周程确认，9 月 9–10 日在柏林举行货币政策会议，9 月 10 日 14:15 CET 公布政策决定，14:45 举行新闻发布会，并在 15:45 发布新的欧元区宏观经济预测。",
              "information_type": "官方会议日程",
              "url": "https://www.ecb.europa.eu/press/calendars/weekly/html/index.en.html"
            },
            {
              "source_level": "context",
              "source_name": "Bank of England",
              "published": "2026-09-04",
              "title": "Interest rates and Bank Rate: our latest decision",
              "summary": "本周英国央行没有新的利率决定。当前 Bank Rate 仍为 3.75%，下一次 MPC 决议将于 9 月 17 日公布。英国央行继续强调中东冲突导致的能源价格高企和波动性。",
              "information_type": "政策基线 / 官方日程",
              "url": "https://www.bankofengland.co.uk/monetary-policy/the-interest-rate-bank-rate.%C2%A0"
            }
          ]
        },
        {
          "name": "中国与日本",
          "items": [
            {
              "source_level": "primary",
              "source_name": "World Gold Council",
              "published": "2026-09-03",
              "title": "Central Bank Gold Statistics: Central banks make positive headlines on gold",
              "summary": "世界黄金协会基于 IMF 和各国央行已报告数据统计，7 月全球央行净购金约 23 吨。中国当月买入约 20 吨，波兰约 8 吨；俄罗斯卖出约 6 吨。中国年初至 7 月累计增加约 60 吨，官方黄金储备约 2,366 吨，占其总储备约 8%。",
              "why_it_matters": "央行购金仍是黄金市场最重要的结构性需求之一。月度数据具有滞后性，但可用于区分短期价格波动和中长期储备配置趋势。",
              "information_type": "行业一手汇总的央行储备统计",
              "url": "https://www.gold.org/goldhub/gold-focus/2026/09/central-bank-gold-statistics-central-banks-make-positive-headlines-gold"
            },
            {
              "source_level": "media",
              "source_name": "Reuters",
              "published": "2026-09-07",
              "title": "Japan's August foreign reserves post largest-ever drop after record intervention",
              "summary": "Reuters 援引日本财务省数据称，日本 8 月外汇储备减少 796 亿美元至约 1.208 万亿美元，为有记录以来最大单月降幅。主要原因是日本为支撑日元实施大规模买入日元、卖出美元的外汇干预，并出售部分外汇证券。",
              "why_it_matters": "大规模外汇储备调整会影响美债供需、日元和全球利率市场，是黄金跨资产环境的重要背景变量。",
              "information_type": "官方数据的媒体报道",
              "url": "https://www.reuters.com/world/asia-pacific/japans-august-foreign-reserves-post-largest-ever-drop-after-record-intervention-2026-09-07/"
            }
          ]
        }
      ]
    },
    {
      "id": "gold",
      "title": "黄金市场、资金流与供需",
      "groups": [
        {
          "name": "价格与资金流",
          "items": [
            {
              "source_level": "media",
              "source_name": "Reuters",
              "published": "2026-09-07",
              "title": "Gold slips on rate-hike bets; inflation data in focus",
              "summary": "9 月 7 日亚洲时段，现货黄金下跌约 0.6%至 4,402.86 美元/盎司附近，延续 9 月 4 日就业报告后的跌势。Reuters 报道中，交易员当时定价的 9 月加息概率约为 58.4%，市场焦点转向本周美国 PPI 和 CPI。",
              "caveat": "这是动态行情和期货市场定价，并非收盘价或官方政策预测。",
              "information_type": "黄金行情与政策预期报道",
              "url": "https://www.reuters.com/world/india/gold-eases-robust-us-payrolls-boost-rate-hike-bets-inflation-data-focus-2026-09-07/"
            },
            {
              "source_level": "media",
              "source_name": "Reuters",
              "published": "2026-09-04",
              "title": "Global money funds draw biggest inflow in nearly a month as investors turn cautious",
              "summary": "截至 9 月 2 日的一周，全球货币市场基金净流入约 461 亿美元，为近一个月最大单周流入。Reuters 同时指出，黄金和贵金属基金继续获得资金流入，而能源基金连续第三周流出。市场避险情绪与美国—伊朗冲突、全球债市抛售和美联储偏鹰信号有关。",
              "caveat": "Reuters 摘要未在公开正文摘要中给出黄金基金的精确美元流入额，因此本期只记录方向，不自行补造具体数字。",
              "information_type": "基金流向媒体汇总",
              "url": "https://www.reuters.com/world/china/global-markets-flows-graphic-2026-09-04/"
            },
            {
              "source_level": "research",
              "source_name": "World Gold Council",
              "published": "2026-09-01",
              "title": "Weekly Markets Monitor - Talking tough",
              "summary": "WGC 的周度市场监测指出，Warsh 在 Jackson Hole 的偏鹰讲话推动 2 年期美债收益率明显上升，黄金跌破其 200 日移动均线。报告同时把伊朗制裁升级、加拿大贸易摩擦以及美国通胀黏性列为当时黄金市场的重要宏观背景。",
              "caveat": "这是 WGC 的市场分析，而不是官方统计或确定性价格预测。",
              "information_type": "行业研究与市场分析",
              "url": "https://www.gold.org/goldhub/gold-focus/2026/09/weekly-markets-monitor-talking-tough"
            }
          ]
        },
        {
          "name": "央行需求",
          "items": [
            {
              "source_level": "primary",
              "source_name": "World Gold Council",
              "published": "2026-09-03",
              "title": "Central Bank Gold Statistics: Central banks make positive headlines on gold",
              "summary": "7 月全球央行已报告净购金约 23 吨，年初至 7 月累计购金约 130 吨。除中国和波兰外，捷克、哈萨克斯坦、马来西亚和玻利维亚等央行亦有净买入；俄罗斯、土耳其等出现净卖出。",
              "why_it_matters": "央行购金继续提供结构性需求，但月度流量并不能解释每一天的金价变化。",
              "information_type": "央行黄金储备统计",
              "url": "https://www.gold.org/goldhub/gold-focus/2026/09/central-bank-gold-statistics-central-banks-make-positive-headlines-gold"
            }
          ]
        }
      ]
    },
    {
      "id": "geopolitics",
      "title": "地缘政治与战争",
      "note": "战争和制裁信息按可观察事实、官方说法和媒体分析分别呈现；单方军事或政治声明不自动视为已独立验证。",
      "groups": [
        {
          "name": "美国—伊朗与霍尔木兹海峡",
          "items": [
            {
              "source_level": "media",
              "source_name": "Reuters",
              "published": "2026-09-06",
              "title": "Hormuz traffic dips to lowest since May after US, Iranian strikes on ships",
              "summary": "Reuters 基于 Kpler 船舶数据报道称，过去 10 天霍尔木兹海峡商品船平均每日通行量降至约 10 艘，为 5 月以来最低水平；9 月 5 日一度只有两艘商品船通行。近期美伊双方对油轮和相关船只的军事行动，使商业航运风险明显升高。",